{
  "type": "object",
  "additionalProperties": false,
  "title": "Settlement Sports Stream Message",
  "$schema": "http://json-schema.org/draft-07/schema#",
  "definitions": {
    "Origin": {
      "type": "object",
      "properties": {
        "environment": {
          "oneOf": [
            {
              "type": "null",
              "title": "Not included"
            },
            {
              "type": "string"
            }
          ]
        },
        "type": {
          "oneOf": [
            {
              "type": "null",
              "title": "Not included"
            },
            {
              "type": "string"
            }
          ]
        },
        "stream": {
          "oneOf": [
            {
              "type": "null",
              "title": "Not included"
            },
            {
              "type": "string"
            }
          ]
        },
        "version": {
          "oneOf": [
            {
              "type": "null",
              "title": "Not included"
            },
            {
              "type": "string"
            }
          ]
        }
      },
      "additionalProperties": false
    },
    "League": {
      "type": "object",
      "properties": {
        "format": {
          "oneOf": [
            {
              "type": "null",
              "title": "Not included"
            },
            {
              "type": "string"
            }
          ]
        },
        "title": {
          "oneOf": [
            {
              "type": "null",
              "title": "Not included"
            },
            {
              "type": "string"
            }
          ]
        },
        "id": {
          "oneOf": [
            {
              "type": "null",
              "title": "Not included"
            },
            {
              "type": "string"
            }
          ]
        }
      },
      "additionalProperties": false
    },
    "LiveGamePeriod": {
      "type": "object",
      "properties": {
        "name": {
          "oneOf": [
            {
              "type": "null",
              "title": "Not included"
            },
            {
              "type": "string"
            }
          ]
        },
        "id": {
          "oneOf": [
            {
              "type": "null",
              "title": "Not included"
            },
            {
              "type": "string"
            }
          ]
        }
      },
      "additionalProperties": false
    },
    "OddOddsHistory": {
      "type": "object",
      "properties": {
        "id": {
          "oneOf": [
            {
              "type": "null",
              "title": "Not included"
            },
            {
              "type": "string"
            }
          ]
        },
        "value": {
          "oneOf": [
            {
              "type": "null",
              "title": "Not included"
            },
            {
              "type": "number"
            }
          ]
        },
        "key": {
          "oneOf": [
            {
              "type": "null",
              "title": "Not included"
            },
            {
              "type": "string"
            }
          ]
        },
        "isValid": {
          "oneOf": [
            {
              "type": "null",
              "title": "Not included"
            },
            {
              "type": "boolean"
            }
          ]
        }
      },
      "additionalProperties": false
    },
    "EventInfo": {
      "type": "object",
      "properties": {
        "country": {
          "oneOf": [
            {
              "type": "null",
              "title": "Not included"
            },
            {
              "$ref": "#/definitions/Country"
            }
          ]
        },
        "teams": {
          "oneOf": [
            {
              "type": "null",
              "title": "Not included"
            },
            {
              "$ref": "#/definitions/Teams"
            }
          ]
        },
        "league": {
          "oneOf": [
            {
              "type": "null",
              "title": "Not included"
            },
            {
              "$ref": "#/definitions/League"
            }
          ]
        },
        "liveGamePeriod": {
          "oneOf": [
            {
              "type": "null",
              "title": "Not included"
            },
            {
              "$ref": "#/definitions/LiveGamePeriod"
            }
          ]
        },
        "id": {
          "oneOf": [
            {
              "type": "null",
              "title": "Not included"
            },
            {
              "type": "string"
            }
          ]
        },
        "state": {
          "oneOf": [
            {
              "type": "null",
              "title": "Not included"
            },
            {
              "type": "string"
            }
          ]
        },
        "liveMinute": {
          "oneOf": [
            {
              "type": "null",
              "title": "Not included"
            },
            {
              "type": "integer"
            }
          ]
        },
        "marketsCount": {
          "oneOf": [
            {
              "type": "null",
              "title": "Not included"
            },
            {
              "type": "integer"
            }
          ]
        },
        "sport": {
          "oneOf": [
            {
              "type": "null",
              "title": "Not included"
            },
            {
              "$ref": "#/definitions/Sport"
            }
          ]
        },
        "startDate": {
          "oneOf": [
            {
              "type": "null",
              "title": "Not included"
            },
            {
              "type": "string"
            }
          ]
        },
        "status": {
          "oneOf": [
            {
              "type": "null",
              "title": "Not included"
            },
            {
              "type": "string"
            }
          ]
        },
        "timeRange": {
          "oneOf": [
            {
              "type": "null",
              "title": "Not included"
            },
            {
              "type": "string"
            }
          ]
        }
      },
      "additionalProperties": false
    },
    "LineInfo": {
      "type": "object",
      "properties": {
        "lineEntity": {
          "oneOf": [
            {
              "type": "null",
              "title": "Not included"
            },
            {
              "$ref": "#/definitions/LineEntity"
            }
          ]
        },
        "isValid": {
          "oneOf": [
            {
              "type": "null",
              "title": "Not included"
            },
            {
              "type": "boolean"
            }
          ]
        },
        "index": {
          "oneOf": [
            {
              "type": "null",
              "title": "Not included"
            },
            {
              "type": "integer"
            }
          ]
        },
        "id": {
          "oneOf": [
            {
              "type": "null",
              "title": "Not included"
            },
            {
              "type": "string"
            }
          ]
        },
        "gamePeriod": {
          "oneOf": [
            {
              "type": "null",
              "title": "Not included"
            },
            {
              "$ref": "#/definitions/GamePeriod"
            }
          ]
        },
        "marketType": {
          "oneOf": [
            {
              "type": "null",
              "title": "Not included"
            },
            {
              "$ref": "#/definitions/MarketType"
            }
          ]
        },
        "updatedAt": {
          "oneOf": [
            {
              "type": "null",
              "title": "Not included"
            },
            {
              "type": "string"
            }
          ]
        },
        "spread": {
          "oneOf": [
            {
              "type": "null",
              "title": "Not included"
            },
            {
              "type": "number"
            }
          ]
        }
      },
      "additionalProperties": false
    },
    "LineEntity": {
      "type": "object",
      "properties": {
        "name": {
          "oneOf": [
            {
              "type": "null",
              "title": "Not included"
            },
            {
              "type": "string"
            }
          ]
        },
        "id": {
          "oneOf": [
            {
              "type": "null",
              "title": "Not included"
            },
            {
              "type": "string"
            }
          ]
        }
      },
      "additionalProperties": false
    },
    "Sport": {
      "type": "object",
      "properties": {
        "title": {
          "oneOf": [
            {
              "type": "null",
              "title": "Not included"
            },
            {
              "type": "string"
            }
          ]
        },
        "id": {
          "oneOf": [
            {
              "type": "null",
              "title": "Not included"
            },
            {
              "type": "string"
            }
          ]
        }
      },
      "additionalProperties": false
    },
    "Country": {
      "type": "object",
      "properties": {
        "title": {
          "oneOf": [
            {
              "type": "null",
              "title": "Not included"
            },
            {
              "type": "string"
            }
          ]
        },
        "id": {
          "oneOf": [
            {
              "type": "null",
              "title": "Not included"
            },
            {
              "type": "string"
            }
          ]
        }
      },
      "additionalProperties": false
    },
    "Teams": {
      "type": "object",
      "properties": {
        "away": {
          "oneOf": [
            {
              "type": "null",
              "title": "Not included"
            },
            {
              "$ref": "#/definitions/Team"
            }
          ]
        },
        "home": {
          "oneOf": [
            {
              "type": "null",
              "title": "Not included"
            },
            {
              "$ref": "#/definitions/Team"
            }
          ]
        }
      },
      "additionalProperties": false
    },
    "GamePeriod": {
      "type": "object",
      "properties": {
        "name": {
          "oneOf": [
            {
              "type": "null",
              "title": "Not included"
            },
            {
              "type": "string"
            }
          ]
        },
        "id": {
          "oneOf": [
            {
              "type": "null",
              "title": "Not included"
            },
            {
              "type": "string"
            }
          ]
        }
      },
      "additionalProperties": false
    },
    "Team": {
      "type": "object",
      "properties": {
        "name": {
          "oneOf": [
            {
              "type": "null",
              "title": "Not included"
            },
            {
              "type": "string"
            }
          ]
        },
        "id": {
          "oneOf": [
            {
              "type": "null",
              "title": "Not included"
            },
            {
              "type": "string"
            }
          ]
        }
      },
      "additionalProperties": false
    },
    "MarketType": {
      "type": "object",
      "properties": {
        "name": {
          "oneOf": [
            {
              "type": "null",
              "title": "Not included"
            },
            {
              "type": "string"
            }
          ]
        },
        "id": {
          "oneOf": [
            {
              "type": "null",
              "title": "Not included"
            },
            {
              "type": "string"
            }
          ]
        }
      },
      "additionalProperties": false
    }
  },
  "properties": {
    "eventInfo": {
      "oneOf": [
        {
          "type": "null",
          "title": "Not included"
        },
        {
          "$ref": "#/definitions/EventInfo"
        }
      ]
    },
    "lineInfo": {
      "oneOf": [
        {
          "type": "null",
          "title": "Not included"
        },
        {
          "$ref": "#/definitions/LineInfo"
        }
      ]
    },
    "origin": {
      "oneOf": [
        {
          "type": "null",
          "title": "Not included"
        },
        {
          "$ref": "#/definitions/Origin"
        }
      ]
    },
    "id": {
      "oneOf": [
        {
          "type": "null",
          "title": "Not included"
        },
        {
          "type": "string"
        }
      ]
    },
    "odd": {
      "oneOf": [
        {
          "type": "null",
          "title": "Not included"
        },
        {
          "$ref": "#/definitions/OddOddsHistory"
        }
      ]
    },
    "status": {
      "oneOf": [
        {
          "type": "null",
          "title": "Not included"
        },
        {
          "type": "string"
        }
      ]
    },
    "timestamp": {
      "oneOf": [
        {
          "type": "null",
          "title": "Not included"
        },
        {
          "type": "string"
        }
      ]
    }
  }
}