{
  "origin": {
    "stream": "sport",
    "type": "settlement",
    "environment": "prod",
    "version": "1.0.0"
  },
  "id": "422796af-4661-11ee-8243-42010a9c003a",
  "status": "win",
  "eventInfo": {
    "id": "6540840",
    "state": "live",
    "status": "running",
    "liveGamePeriod": {
      "name": "2h"
    },
    "liveMinute": 1,
    "marketsCount": 5,
    "startDate": "2023-08-29 11:30:00+0000",
    "timeRange": "today",
    "sport": {
      "id": "1",
      "title": "Football",
      "key": "soccer"
    },
    "country": {
      "id": "1",
      "title": "International"
    },
    "league": {
      "id": "16596",
      "title": "Esoccer Friendly - 15 mins play"
    },
    "teams": {
      "home": {
        "id": "206115",
        "name": "Everton Virtual",
        "color": ""
      },
      "away": {
        "id": "208486",
        "name": "Juventus Virtual",
        "color": ""
      }
    }
  },
  "lineInfo": {
    "id": "476916281",
    "index": 2,
    "updatedAt": "2023-08-29 11:44:24.222+0000",
    "marketType": {
      "id": "3",
      "name": "Over/Under"
    },
    "lineEntity": {
      "id": "1",
      "name": "Goals"
    },
    "gamePeriod": {
      "id": "2",
      "name": "Full Time"
    },
    "isValid": false,
    "spread": 1
  },
  "odd": {
    "id": "e_3404677826",
    "key": "over",
    "value": 1.583,
    "isValid": true
  },
  "timestamp": "2023-08-29 11:58:21.017+0000"
}